{
  "$schema": "../schema.json",
  "exploit_id": "AML.T0024.001",
  "title": "Invert AI Model — reconstruct training data via confidence scores",
  "description": "An adversary reconstructs training data (or sensitive feature values) by strategically querying the inference API and exploiting confidence scores or output probabilities. Variants include reconstructing image inputs from facial-recognition logits, recovering attribute values from regression confidence, and (for LLM embedding APIs) recovering source text from embedding vectors via inverter models like Vec2Text. The Vec2Text family demonstrated ~92% short-text recovery from text-embedding-ada-002 with high re-identification rates on clinical notes.",
  "target_component": "embedding_model",
  "dsgai_mapping": ["DSGAI18", "DSGAI13", "DSGAI01"],
  "mitre_atlas_mapping": ["AML.T0024.001"],
  "owasp_llm_top10_mapping": ["LLM02:2025", "LLM02:2026"],
  "attack_steps": [
    "Identify the inversion target — image input, regression attribute, or embedding vector.",
    "Train (or download) an inverter that maps confidence/embedding outputs back to inputs.",
    "Query the target with strategic samples and feed the outputs through the inverter.",
    "Recover the reconstructed inputs or attribute values."
  ],
  "prerequisites": [
    "Inference access to the target model.",
    "Compute and matching-domain data to train the inverter (sometimes available from public datasets)."
  ],
  "impact": [
    "training_data_disclosure",
    "data_exfiltration"
  ],
  "detection_indicators": [
    "High-volume queries that systematically vary inputs in the embedding space.",
    "Bulk embedding-API queries with no downstream retrieval usage (extraction signature)."
  ],
  "severity": {
    "qualitative": "High"
  },
  "source_urls": [
    "https://atlas.mitre.org/techniques/AML.T0024.001",
    "https://arxiv.org/abs/2310.06816"
  ],
  "date_documented": "2022-10-21",
  "date_added": "2026-05-18",
  "disclosure_status": "atlas_catalog",
  "exploited_in_the_wild": "suspected",
  "mitigations": [
    "Treat stored embeddings as sensitive as the source text; apply the same access controls.",
    "Apply differential privacy to embeddings of high-sensitivity corpora before storage.",
    "Rate-limit and audit bulk embedding-API queries."
  ],
  "related_vulnerabilities": [
    "DSGAI-VULN-2023-vec2text-embedding-inversion"
  ],
  "tags": ["model-inversion", "embedding-inversion", "vec2text", "privacy-attack"]
}
