{
  "$schema": "../schema.json",
  "exploit_id": "AML.T0011.001",
  "title": "Malicious Package — User Execution",
  "description": "An adversary publishes a malicious software package that appears useful for an AI-related task. When a developer imports it (often after the package was suggested by an LLM or named with a plausible AI-themed slug) the package executes attacker-controlled code at install or import time. This includes typosquatted variants of popular ML libraries, packages weaponized via slopsquatted hallucinated names (AML.T0060), and dependencies introduced via AI Supply Chain Compromise (AML.T0010).",
  "target_component": "training_pipeline",
  "dsgai_mapping": ["DSGAI04", "DSGAI03"],
  "mitre_atlas_mapping": ["AML.T0011.001", "AML.T0060"],
  "owasp_llm_top10_mapping": ["LLM03:2025", "LLM04:2026"],
  "attack_steps": [
    "Pick a target audience and package ecosystem (PyPI, npm, RubyGems, crates.io).",
    "Choose a name — typosquat a popular library, claim a hallucinated name, or fabricate a plausible AI-utility name.",
    "Implement legitimate-looking surface functionality plus a malicious payload (post-install script, import-time side effect, lazy backdoor on specific function call).",
    "Publish; promote via blog posts, social channels, or LLM-suggested install instructions."
  ],
  "prerequisites": [
    "Publishing account on a package ecosystem."
  ],
  "impact": [
    "supply_chain_compromise",
    "credential_exposure",
    "integrity_compromise"
  ],
  "detection_indicators": [
    "New low-history packages installed by AI/ML projects.",
    "Post-install scripts, network connections from import-time code, or executable code in setup.py beyond build essentials.",
    "Typosquatted names against popular libraries (transfomers, langhain, opanai)."
  ],
  "severity": {
    "qualitative": "High"
  },
  "source_urls": [
    "https://atlas.mitre.org/techniques/AML.T0011.001"
  ],
  "date_documented": "2024-12-01",
  "date_added": "2026-05-18",
  "disclosure_status": "atlas_catalog",
  "exploited_in_the_wild": "yes",
  "mitigations": [
    "Use internal package mirrors with allowlisting; do not pull from public registries at build time.",
    "Pin and audit dependencies; require SBOM signatures from a known publisher.",
    "Scan packages for unusual install-time behavior before promotion to production."
  ],
  "tags": ["malicious-package", "supply-chain", "typosquatting"]
}
