{
  "$schema": "../schema.json",
  "exploit_id": "AML.T0067",
  "title": "LLM Trusted Output Components Manipulation",
  "description": "An adversary uses prompts to manipulate components of the model's response that the user reads as authoritative — language tone, link targets, recommended follow-up actions, citations, retrieved document metadata. By making the malicious output look trustworthy (fake citations, professional tone, plausible source attribution), the adversary continues to operate inside the user's environment and steers downstream user actions while evading suspicion. Particularly potent in research, code-assistant, and customer-support contexts where users rely on the assistant to vet sources.",
  "target_component": "agent_framework",
  "dsgai_mapping": ["DSGAI21", "DSGAI06", "DSGAI15"],
  "mitre_atlas_mapping": ["AML.T0067", "AML.T0067.000"],
  "owasp_llm_top10_mapping": ["LLM02:2025", "LLM08:2025", "LLM02:2026", "LLM09:2026"],
  "attack_steps": [
    "Establish an injection or jailbreak foothold (AML.T0051 / AML.T0054).",
    "Direct the model to format the malicious payload as a trusted output component — a citation, a 'recommended next step', a quoted source.",
    "Optionally fabricate plausible-looking metadata (author, date, journal name) so the citation appears legitimate.",
    "The user trusts the rendered component and acts on it (clicking a link, copying a command, accepting a recommendation)."
  ],
  "prerequisites": [
    "Foothold via prompt injection or jailbreak."
  ],
  "impact": [
    "integrity_compromise",
    "reputational_harm",
    "data_exfiltration"
  ],
  "detection_indicators": [
    "Citations that point to hosts the model has never previously cited.",
    "Recommended-action links that route through redirector or shortener services.",
    "Inconsistent author/date metadata in fabricated citations.",
    "Discrepancy between the model's claimed source and the actual retrieved document."
  ],
  "severity": {
    "qualitative": "High"
  },
  "source_urls": [
    "https://atlas.mitre.org/techniques/AML.T0067"
  ],
  "date_documented": "2024-12-01",
  "date_added": "2026-05-18",
  "disclosure_status": "atlas_catalog",
  "exploited_in_the_wild": "yes",
  "mitigations": [
    "Verify cited sources against the retrieval log; reject responses claiming sources the retrieval system did not return.",
    "Render only the canonical citation URL from the retrieval index; do not let the model author URLs in citations.",
    "Allowlist domains the assistant may cite in its responses for sensitive surfaces."
  ],
  "tags": ["citation-spoofing", "social-engineering", "output-manipulation"]
}
