{
  "$schema": "../schema.json",
  "exploit_id": "AML.T0051.002",
  "title": "Triggered LLM Prompt Injection",
  "description": "An adversary plants a prompt injection that activates only when a specific event occurs in the victim environment — a user action, a keyword, a scheduled task, a tool invocation. Triggered injections particularly target AI agents and are often paired with Prompt Infiltration via Public-Facing Application (AML.T0093) to seed the payload, plus Delay Execution of LLM Instructions (AML.T0094) to defer activation past untrusted-context guards. The defender's hardest problem is that the injection sits dormant until a privileged context loads it.",
  "target_component": "agent_framework",
  "dsgai_mapping": ["DSGAI06", "DSGAI15", "DSGAI21"],
  "mitre_atlas_mapping": ["AML.T0051.002", "AML.T0093", "AML.T0094"],
  "owasp_llm_top10_mapping": ["LLM01:2025", "LLM02:2025", "LLM01:2026", "LLM02:2026"],
  "attack_steps": [
    "Discover the agent's activation triggers and tool surface (AML.T0084.002).",
    "Place a conditional payload in a content surface the agent will later ingest in a trusted context.",
    "Wait for the activation event (specific keyword, scheduled retrieval, new-MR comment, calendar invite, etc.).",
    "On activation, the conditional fires and the agent executes the embedded instructions in a context where guards are relaxed."
  ],
  "prerequisites": [
    "Knowledge of an activation trigger the target agent honors.",
    "Write access to a surface ingested in the privileged context."
  ],
  "impact": [
    "policy_bypass",
    "data_exfiltration",
    "integrity_compromise"
  ],
  "detection_indicators": [
    "Agent behavior change correlated with specific keywords or scheduled events.",
    "Tool invocations during seemingly benign turns that ingest pre-existing content.",
    "Injection payloads referencing future-tense triggers ('when the user next asks...', 'on the next run...')."
  ],
  "severity": {
    "qualitative": "High"
  },
  "source_urls": [
    "https://atlas.mitre.org/techniques/AML.T0051.002"
  ],
  "date_documented": "2025-04-09",
  "date_added": "2026-05-18",
  "disclosure_status": "atlas_catalog",
  "exploited_in_the_wild": "suspected",
  "mitigations": [
    "Apply context taint-tracking — never grant tool privileges to a turn whose context window contains content from untrusted ingestion.",
    "Audit content sources for conditional injection patterns and future-tense imperatives.",
    "Re-evaluate trust on every turn; do not assume past-turn safety implies current-turn safety."
  ],
  "tags": ["prompt-injection", "triggered-injection", "agent-attack", "deferred-execution"]
}
