{
  "$schema": "../schema.json",
  "exploit_id": "AML.T0057",
  "title": "LLM Data Leakage",
  "description": "An adversary crafts prompts that induce an LLM to leak sensitive information. The leaked content may originate from proprietary training data (memorization), from data sources the model is connected to (RAG, tools, agent memory), or from other users of a shared deployment (cross-context bleed). Eliciting techniques range from direct asks, to high-recall enumeration, to divergence attacks that cause the model to abandon its chat persona and emit training data verbatim (see Nasr/Carlini 2023, arXiv 2311.17035).",
  "target_component": "model",
  "dsgai_mapping": ["DSGAI01", "DSGAI11", "DSGAI18"],
  "mitre_atlas_mapping": ["AML.T0057", "AML.T0024"],
  "owasp_llm_top10_mapping": ["LLM02:2025", "LLM02:2026"],
  "attack_steps": [
    "Identify the leak surface: training-data memorization, RAG corpus, tool-fetched context, or cross-session memory.",
    "Choose an elicitation strategy — direct prompting, enumeration, repetition/divergence attack, persona-switching, or low-temperature seeding.",
    "Issue prompts at scale; collect responses for high-recall content (long verbatim spans, structured PII, secrets).",
    "Optionally combine with jailbreak (AML.T0054) to defeat refusal."
  ],
  "prerequisites": [
    "Query access (or RAG/tool integration that the attacker can influence)."
  ],
  "impact": [
    "data_exfiltration",
    "training_data_disclosure",
    "credential_exposure",
    "cross_tenant_disclosure"
  ],
  "detection_indicators": [
    "High-recall regurgitation patterns in output (long verbatim spans, structured PII, secret-shaped tokens).",
    "User prompts containing enumeration sequences or 'list all', 'continue', 'repeat' patterns at scale.",
    "Anomalous retrieval patterns against vector stores or sensitive corpora."
  ],
  "severity": {
    "qualitative": "Critical"
  },
  "source_urls": [
    "https://atlas.mitre.org/techniques/AML.T0057",
    "https://arxiv.org/abs/2311.17035"
  ],
  "date_documented": "2024-05-09",
  "date_added": "2026-05-18",
  "disclosure_status": "atlas_catalog",
  "exploited_in_the_wild": "yes",
  "mitigations": [
    "Apply DLP/secret detectors on both prompts and outputs.",
    "Use differential privacy during training; audit memorization with extractable-data benchmarks before deployment.",
    "Constrain RAG retrieval to per-user-scoped corpora; never share embedding stores across tenants without strict scoping.",
    "Block markdown rendering paths that allow stealth exfiltration (see AML.T0077)."
  ],
  "related_vulnerabilities": [
    "DSGAI-VULN-2023-chatgpt-divergence-extraction",
    "DSGAI-VULN-2024-slack-ai-indirect-prompt-injection"
  ],
  "tags": ["data-leakage", "memorization", "training-data-extraction"]
}
