{
  "$schema": "../schema.json",
  "exploit_id": "AML.T0068",
  "title": "LLM Prompt Obfuscation",
  "description": "An adversary hides or obfuscates prompt injections or retrieval content to evade detection by humans, LLM guardrails, or upstream filters. Text-based techniques include zero-width and Unicode tag characters, very small or background-colored text, hidden HTML, and encoded payloads (base64, ROT13, hex, mixed-language). Multimodal techniques hide instructions in image pixels, EXIF metadata, audio ID3 tags, or document metadata. The model often still reads the instructions because vision-language models OCR aggressively and text models honor decoded content downstream.",
  "target_component": "guardrail_or_filter",
  "dsgai_mapping": ["DSGAI09", "DSGAI21", "DSGAI06"],
  "mitre_atlas_mapping": ["AML.T0068"],
  "owasp_llm_top10_mapping": ["LLM01:2025", "LLM01:2026"],
  "attack_steps": [
    "Compose the injection payload normally.",
    "Pick an obfuscation channel matched to the target's input pipeline — Unicode tag chars for text, white-on-white HTML for web ingestion, base64/ROT13 for filter evasion, pixel-encoded text or EXIF metadata for vision models.",
    "Embed the obfuscated payload in the surface the model will ingest.",
    "Verify the model still acts on the decoded content while humans and filters miss it."
  ],
  "prerequisites": [
    "Write access to the target ingestion surface.",
    "Knowledge of the rendering and filtering pipeline."
  ],
  "impact": [
    "policy_bypass",
    "integrity_compromise",
    "data_exfiltration"
  ],
  "detection_indicators": [
    "Presence of Unicode tag characters (U+E0000–U+E007F) or zero-width characters in ingested content.",
    "Base64 / ROT13 / hex blobs in user input or retrieved documents.",
    "Image EXIF or PDF metadata containing imperative phrasing.",
    "OCR output of ingested images containing instruction-like text."
  ],
  "severity": {
    "qualitative": "High"
  },
  "source_urls": [
    "https://atlas.mitre.org/techniques/AML.T0068",
    "https://embracethered.com/blog/posts/2024/hiding-and-finding-text-with-unicode-tags/"
  ],
  "date_documented": "2024-05-09",
  "date_added": "2026-05-18",
  "disclosure_status": "atlas_catalog",
  "exploited_in_the_wild": "yes",
  "mitigations": [
    "Strip Unicode tag and zero-width characters from all ingested content before passing to the model.",
    "OCR images and run extracted text through the same injection-detection filters as raw text.",
    "Decode base64/ROT13/hex blobs and re-scan; reject content that decodes to instruction-shaped tokens.",
    "Normalize text (NFKC, lowercase, whitespace collapse) before applying filters."
  ],
  "related_vulnerabilities": [
    "DSGAI-VULN-2025-gitlab-duo-prompt-injection",
    "DSGAI-VULN-2023-multimodal-image-prompt-injection"
  ],
  "tags": ["obfuscation", "unicode-smuggling", "filter-evasion", "multimodal"]
}
