{
  "$schema": "../schema.json",
  "exploit_id": "AML.T0015",
  "title": "Evade AI Model",
  "description": "An adversary uses crafted adversarial inputs (AML.T0043) or generated deepfakes (AML.T0088) to slip past an AI-based detector or classifier. In the security-tool context this means evading malware classifiers, phishing detectors, network anomaly scoring, or content-safety filters; in the AI-system context it means defeating injection-detection classifiers, jailbreak scanners, or biometric authentication. Evasion is often the first step in a longer attack chain.",
  "target_component": "guardrail_or_filter",
  "dsgai_mapping": ["DSGAI05", "DSGAI21"],
  "mitre_atlas_mapping": ["AML.T0015", "AML.T0043"],
  "owasp_llm_top10_mapping": ["LLM01:2025", "LLM01:2026"],
  "attack_steps": [
    "Identify the AI detector or classifier in the path (content-safety filter, anomaly scorer, biometric auth).",
    "Craft inputs that the model misclassifies as benign while preserving the malicious payload's function.",
    "Verify evasion against the live detector (AML.T0042) if access permits.",
    "Use evading inputs to deliver the actual payload (malware, phishing prompt, injection)."
  ],
  "prerequisites": [
    "Knowledge of (or query access to) the target detector."
  ],
  "impact": [
    "policy_bypass",
    "integrity_compromise"
  ],
  "detection_indicators": [
    "Inputs that classify confidently benign while triggering downstream anomalies.",
    "Drift between content-classifier scores and post-hoc human-review scores."
  ],
  "severity": {
    "qualitative": "High"
  },
  "source_urls": [
    "https://atlas.mitre.org/techniques/AML.T0015"
  ],
  "date_documented": "2022-10-21",
  "date_added": "2026-05-18",
  "disclosure_status": "atlas_catalog",
  "exploited_in_the_wild": "yes",
  "mitigations": [
    "Ensemble defenses — never rely on a single AI classifier as a security control.",
    "Add deterministic rules alongside AI classifiers; the rules catch what the classifier misses and vice versa.",
    "Adversarial training and continuous red-team evaluation of detectors."
  ],
  "tags": ["evasion", "classifier-bypass", "adversarial-example"]
}
