{
  "$schema": "../schema.json",
  "exploit_id": "AML.T0024.000",
  "title": "Infer Training Data Membership",
  "description": "An adversary determines whether a specific data sample was used to train the target model. Some approaches train a shadow model on similar data and compare loss / confidence profiles; others exploit raw inference-score statistics on the target model directly. Successful membership inference is a privacy violation in itself (proves a specific PII record or copyrighted document was in the training set) and an enabling step for attribute inference and model inversion.",
  "target_component": "model",
  "dsgai_mapping": ["DSGAI18", "DSGAI01"],
  "mitre_atlas_mapping": ["AML.T0024.000"],
  "owasp_llm_top10_mapping": ["LLM02:2025", "LLM02:2026"],
  "attack_steps": [
    "Acquire or train a shadow model on data similar in distribution to the suspected training set (AML.T0005.001).",
    "Compute membership-score features (loss, confidence margin, perplexity) for candidate samples on the shadow model.",
    "Calibrate a classifier that maps score features to member/non-member.",
    "Apply the classifier to the target model's outputs on the candidate samples."
  ],
  "prerequisites": [
    "Inference access to the target model.",
    "Access to similar-distribution data and compute to train a shadow model (for shadow-model variants)."
  ],
  "impact": [
    "training_data_disclosure"
  ],
  "detection_indicators": [
    "Coordinated paired-sample queries that compare in-distribution vs out-of-distribution candidates.",
    "Large query bursts probing the same sample with prompt variations."
  ],
  "severity": {
    "qualitative": "Medium"
  },
  "source_urls": [
    "https://atlas.mitre.org/techniques/AML.T0024.000"
  ],
  "date_documented": "2022-10-21",
  "date_added": "2026-05-18",
  "disclosure_status": "atlas_catalog",
  "exploited_in_the_wild": "suspected",
  "mitigations": [
    "Train with differential privacy or DP-SGD to bound membership-inference success rates.",
    "Audit memorization with extractable-data benchmarks; track membership-inference AUC across releases.",
    "Restrict access to per-token log-probabilities; do not expose unless required."
  ],
  "tags": ["membership-inference", "privacy-attack"]
}
