{
  "$schema": "../schema.json",
  "exploit_id": "DSGAI-EXP-autodan-stealthy-jailbreak",
  "title": "AutoDAN — stealthy genetic-algorithm jailbreak",
  "description": "Liu et al. (arXiv 2310.04451) introduced AutoDAN, a hierarchical genetic algorithm that evolves human-readable jailbreak prompts. Unlike GCG, which produces nonsensical suffixes that perplexity filters can flag, AutoDAN's outputs read like fluent natural-language directives, defeating perplexity-based defenses and reading the room as 'a long persuasive instruction' rather than 'gibberish'. Transfer across closed models is strong.",
  "target_component": "model",
  "dsgai_mapping": ["DSGAI21", "DSGAI01"],
  "mitre_atlas_mapping": ["AML.T0054", "AML.T0043.001"],
  "owasp_llm_top10_mapping": ["LLM01:2025", "LLM01:2026"],
  "attack_steps": [
    "Seed an initial population of candidate jailbreak prompts.",
    "Use a fitness function (e.g. refusal-prefix logprob) to score candidates.",
    "Apply crossover and mutation operators at sentence and paragraph levels.",
    "Iterate until the population converges on jailbreak prompts; deploy against the target."
  ],
  "prerequisites": [
    "Query access to (or white-box weights of) a model in the same family as the target.",
    "Compute for the GA loop."
  ],
  "impact": [
    "policy_bypass",
    "reputational_harm"
  ],
  "detection_indicators": [
    "Long, persuasive user prompts containing combinations of jailbreak heuristics (roleplay + override + format constraint + urgency).",
    "Same phrases recurring across unrelated sessions with high success rate."
  ],
  "severity": {
    "qualitative": "High"
  },
  "source_urls": [
    "https://arxiv.org/abs/2310.04451"
  ],
  "date_documented": "2023-10-06",
  "date_added": "2026-05-18",
  "disclosure_status": "research_publication",
  "exploited_in_the_wild": "suspected",
  "mitigations": [
    "Add post-generation safety classifiers; do not rely on input perplexity alone.",
    "Train against AutoDAN-style population corpora; track refusal stability under stealth jailbreaks as a release gate."
  ],
  "tags": ["jailbreak", "genetic-algorithm", "stealthy-jailbreak", "perplexity-evasion"]
}
