{
  "$schema": "../schema.json",
  "exploit_id": "DSGAI-EXP-cipher-encoded-prompt",
  "title": "Cipher — encoded-prompt jailbreak (base64, ROT13, leetspeak, low-resource languages)",
  "description": "Yuan et al. (CipherChat, arXiv 2308.06463) and many follow-ups demonstrated that requests transformed via Caesar cipher, ROT13, base64, hex, leetspeak, or a low-resource language frequently bypass safety filters trained primarily on English plaintext, while the model still decodes and answers the underlying request. The technique is the canonical 'simple obfuscation defeats classifier' attack and routinely appears in published jailbreak suites.",
  "target_component": "guardrail_or_filter",
  "dsgai_mapping": ["DSGAI21", "DSGAI01"],
  "mitre_atlas_mapping": ["AML.T0068", "AML.T0054"],
  "owasp_llm_top10_mapping": ["LLM01:2025", "LLM01:2026"],
  "attack_steps": [
    "Encode the disallowed request via a transformation the model can reverse but the filter does not normalize (Caesar, ROT13, base64, hex, leetspeak, translation).",
    "Optionally prefix the prompt with instructions telling the model what encoding was used.",
    "Submit; the model decodes the request and answers."
  ],
  "prerequisites": [
    "Query access."
  ],
  "impact": [
    "policy_bypass"
  ],
  "detection_indicators": [
    "Prompts containing base64/hex/ROT13 blobs.",
    "Prompts that explicitly tell the model 'decode this' followed by an encoded blob.",
    "Cross-lingual prompts whose answer language switches mid-response."
  ],
  "severity": {
    "qualitative": "Medium"
  },
  "source_urls": [
    "https://arxiv.org/abs/2308.06463",
    "https://arxiv.org/abs/2310.02446"
  ],
  "date_documented": "2023-08-12",
  "date_added": "2026-05-18",
  "disclosure_status": "research_publication",
  "exploited_in_the_wild": "yes",
  "mitigations": [
    "Decode base64/hex/ROT13/Caesar/leetspeak input blobs before running safety classifiers; run classifiers on the decoded form.",
    "Beware cross-lingual leakage: regex filters do not transfer to non-English; translate user input through the safety classifier in all in-scope languages.",
    "Block or rate-limit prompts that ask the model to operate on encoded payloads."
  ],
  "tags": ["jailbreak", "encoding-bypass", "cipher", "cross-lingual", "obfuscation"]
}
