{
  "$schema": "../schema.json",
  "exploit_id": "AML.T0099",
  "title": "AI Agent Tool Data Poisoning",
  "description": "An adversary places malicious content in a location an AI agent's tool will later retrieve. The agent's tool — a search index, a CRM lookup, a ticket system query, a file browser — surfaces the poisoned data as part of normal tool usage, and the agent then acts on it as if it were trusted operational data. Distinguishable from RAG Poisoning (AML.T0070) by targeting tool-fetched data paths specifically rather than the indexed retrieval corpus.",
  "target_component": "plugin_or_tool",
  "dsgai_mapping": ["DSGAI04", "DSGAI06", "DSGAI21"],
  "mitre_atlas_mapping": ["AML.T0099"],
  "owasp_llm_top10_mapping": ["LLM01:2025", "LLM04:2025", "LLM01:2026", "LLM05:2026"],
  "attack_steps": [
    "Identify a data source the target agent's tools query (CRM, ticket system, mailbox, shared drive, knowledge base).",
    "Plant content that will surface for common queries — title it to match high-traffic searches, or include keywords likely to be retrieved.",
    "Embed the malicious payload (false information, prompt injection, citation poisoning) inside the planted content.",
    "Wait for the agent to retrieve and act on it."
  ],
  "prerequisites": [
    "Write access — direct or indirect — to a system queried by the agent's tools."
  ],
  "impact": [
    "integrity_compromise",
    "data_exfiltration",
    "policy_bypass"
  ],
  "detection_indicators": [
    "New documents/records in tool-queried sources that contain imperative phrasing.",
    "Tool-fetched content with suspiciously SEO-tuned titles or metadata.",
    "Agent behavior changes correlated with retrieval from a single newly-added source."
  ],
  "severity": {
    "qualitative": "High"
  },
  "source_urls": [
    "https://atlas.mitre.org/techniques/AML.T0099"
  ],
  "date_documented": "2025-04-09",
  "date_added": "2026-05-18",
  "disclosure_status": "atlas_catalog",
  "exploited_in_the_wild": "suspected",
  "mitigations": [
    "Treat tool-fetched content as untrusted; apply the same injection filters as user input.",
    "Audit and rate-limit edit access to systems an agent's tools query.",
    "Tag retrieved content with provenance and exclude untrusted sources from privileged actions."
  ],
  "tags": ["tool-data-poisoning", "agent-attack", "indirect-injection"]
}
