{
  "$schema": "../schema.json",
  "exploit_id": "DSGAI-EXP-gcg-adversarial-suffix",
  "title": "GCG — Greedy Coordinate Gradient universal adversarial suffix",
  "description": "Zou et al. (arXiv 2307.15043) introduced a white-box optimization that finds short, often-nonsensical token suffixes which, when appended to a refused prompt, cause aligned LLMs to comply. The optimization runs against open-weights models but the resulting suffixes transfer at non-trivial rate to closed commercial models (GPT-3.5/4, Claude, Gemini). GCG is the canonical algorithmic jailbreak and the foundation many later optimizers (AutoDAN, PAIR, TAP, GPTFuzzer) build on or compare against.",
  "target_component": "model",
  "dsgai_mapping": ["DSGAI21", "DSGAI01"],
  "mitre_atlas_mapping": ["AML.T0054", "AML.T0043", "AML.T0043.000", "AML.T0043.002"],
  "owasp_llm_top10_mapping": ["LLM01:2025", "LLM01:2026"],
  "attack_steps": [
    "Acquire an open-weights model representative of the eventual target (e.g. Llama 2 or Vicuna).",
    "Optimize a token suffix via greedy coordinate descent against a target objective (model produces an affirmative compliance prefix).",
    "Iterate until the suffix consistently jailbreaks the local model on a held-out set of refused prompts.",
    "Append the suffix to refused prompts against the target deployment; the suffix often transfers across models."
  ],
  "prerequisites": [
    "White-box access to a similar open-weights model.",
    "Modest compute (single GPU for hours)."
  ],
  "impact": [
    "policy_bypass",
    "data_exfiltration",
    "reputational_harm"
  ],
  "detection_indicators": [
    "User prompts ending in non-natural-language token sequences.",
    "High refusal-rate-drop correlated with specific suffix shapes across users.",
    "Repetition of identical suffix substrings across unrelated sessions."
  ],
  "severity": {
    "qualitative": "High"
  },
  "source_urls": [
    "https://arxiv.org/abs/2307.15043",
    "https://llm-attacks.org/"
  ],
  "date_documented": "2023-07-27",
  "date_added": "2026-05-18",
  "disclosure_status": "research_publication",
  "exploited_in_the_wild": "suspected",
  "mitigations": [
    "Filter prompts ending in long non-language token runs.",
    "Train against known-GCG-suffix corpora as part of safety fine-tuning.",
    "Use input-perplexity scoring; reject anomalously low-perplexity tail tokens."
  ],
  "tags": ["jailbreak", "adversarial-suffix", "gcg", "white-box", "transfer-attack"]
}
