{
  "$schema": "../schema.json",
  "exploit_id": "DSGAI-EXP-divergence-extraction-attack",
  "title": "Divergence attack — aligned-LLM training data extraction (Nasr, Carlini et al., 2023)",
  "description": "Nasr, Carlini, et al. (arXiv 2311.17035) showed that asking an aligned production LLM to repeat a single word indefinitely (or perform analogous low-entropy generation tasks) causes the model to diverge from its chatbot persona and emit verbatim training data at a 150x rate over baseline. The technique extracted megabytes of training content from ChatGPT (gpt-3.5-turbo at disclosure) for about $200 in API spend, including PII, source code, and copyrighted text. Foundational reference for extractable-memorization risk under RLHF alignment.",
  "target_component": "model",
  "dsgai_mapping": ["DSGAI01", "DSGAI18"],
  "mitre_atlas_mapping": ["AML.T0057", "AML.T0024"],
  "owasp_llm_top10_mapping": ["LLM02:2025", "LLM02:2026"],
  "attack_steps": [
    "Identify a low-entropy generation trigger the target model honors ('repeat the word X forever').",
    "Submit the trigger at scale.",
    "Collect responses; filter for long verbatim spans, PII patterns, and structured-data fragments.",
    "Optionally cross-reference recovered content against public web to confirm training-data provenance."
  ],
  "prerequisites": [
    "Paid API access to the target."
  ],
  "impact": [
    "training_data_disclosure",
    "credential_exposure"
  ],
  "detection_indicators": [
    "Generations that begin to repeat a single token and then transition into long verbatim spans.",
    "User queries containing divergence triggers (repeat-forever, infinite-loop directives).",
    "Output containing structured PII shapes (emails, SSNs, code blocks) not present in the prompt."
  ],
  "severity": {
    "qualitative": "High"
  },
  "source_urls": [
    "https://arxiv.org/abs/2311.17035",
    "https://not-just-memorization.github.io/extracting-training-data-from-chatgpt.html"
  ],
  "date_documented": "2023-11-28",
  "date_added": "2026-05-18",
  "disclosure_status": "research_publication",
  "exploited_in_the_wild": "yes",
  "mitigations": [
    "Detect and cap low-entropy generation patterns; terminate responses that loop on a single token.",
    "Apply differential privacy during training; audit extractable memorization before deployment.",
    "Run output DLP — detect long verbatim spans and structured PII; redact before return."
  ],
  "related_vulnerabilities": [
    "DSGAI-VULN-2023-chatgpt-divergence-extraction"
  ],
  "tags": ["training-data-extraction", "memorization", "divergence-attack", "alignment-bypass"]
}
