{
  "$schema": "../schema.json",
  "exploit_id": "DSGAI-EXP-dan-roleplay-jailbreak",
  "title": "DAN-family — persona/roleplay jailbreak prompts",
  "description": "The 'Do Anything Now' (DAN) family is the foundational manual jailbreak: a long prompt instructs the model to adopt a persona (DAN, AIM, developer mode, evil twin, fictional AI without filters) that allegedly has no content restrictions, often paired with token-based reward/punishment framing. Dozens of public DAN variants exist; new variants emerge whenever vendors patch the previous version. The pattern is captured in public corpora that defenders use as red-team benchmarks.",
  "target_component": "model",
  "dsgai_mapping": ["DSGAI21"],
  "mitre_atlas_mapping": ["AML.T0054"],
  "owasp_llm_top10_mapping": ["LLM01:2025", "LLM01:2026"],
  "attack_steps": [
    "Pick a DAN variant from the public corpus (or compose one).",
    "Submit the persona-setup prompt to the model; the model is asked to acknowledge the new persona.",
    "Follow up with the disallowed request as the new persona.",
    "Iterate prompt variants when refusals appear, often referencing the persona to recover."
  ],
  "prerequisites": [
    "Query access; no special access required."
  ],
  "impact": [
    "policy_bypass"
  ],
  "detection_indicators": [
    "User prompts containing well-known persona names (DAN, AIM, STAN, developer mode).",
    "Long opening prompts that establish a fictional AI without filters before any real question.",
    "Prompts containing token/reward framing ('every time you refuse, I'll deduct a token...')."
  ],
  "severity": {
    "qualitative": "Medium"
  },
  "source_urls": [
    "https://github.com/0xk1h0/ChatGPT_DAN",
    "https://www.promptfoo.dev/blog/how-to-jailbreak-llms/"
  ],
  "date_documented": "2022-12-01",
  "date_added": "2026-05-18",
  "disclosure_status": "research_publication",
  "exploited_in_the_wild": "yes",
  "mitigations": [
    "Maintain a regularly-updated DAN-corpus filter; flag prompts matching known persona-setup patterns.",
    "Train against the DAN family as part of safety fine-tuning; track refusal stability across variants.",
    "Stable, identity-consistent system prompt that resists user-supplied persona override."
  ],
  "tags": ["jailbreak", "roleplay", "dan", "manual-jailbreak"]
}
