{
  "$schema": "../schema.json",
  "exploit_id": "AML.T0080",
  "title": "AI Agent Context Poisoning",
  "description": "An adversary plants attacker-controlled instructions or preferences into the agent's context — either by writing to its persistent memory (AML.T0080.000) or by injecting into the active thread that the agent later uses as context (AML.T0080.001). Persistent memory poisoning is especially powerful: a single successful injection produces an instruction the agent honors across every future conversation until the memory is cleaned, providing a covert long-term foothold even after the original injection content is removed.",
  "target_component": "agent_framework",
  "dsgai_mapping": ["DSGAI06", "DSGAI15", "DSGAI11"],
  "mitre_atlas_mapping": ["AML.T0080"],
  "owasp_llm_top10_mapping": ["LLM01:2025", "LLM02:2025", "LLM01:2026", "LLM02:2026"],
  "attack_steps": [
    "Identify the agent's memory write surfaces (explicit 'remember this' tool, automatic summarization, thread persistence).",
    "Use prompt injection (often indirect via fetched content) to cause the agent to commit attacker instructions or preferences to memory.",
    "Verify the injected memory survives across sessions.",
    "Each future session inherits the poisoned context; the attacker collects telemetry or maintains persistence without further interaction."
  ],
  "prerequisites": [
    "Injection foothold on a turn where the agent will write to memory or thread state."
  ],
  "impact": [
    "integrity_compromise",
    "data_exfiltration",
    "policy_bypass"
  ],
  "detection_indicators": [
    "Memory entries containing instruction-shaped content rather than user facts.",
    "Memory writes immediately after fetched-content turns.",
    "Persistent behavior changes (style, refusal patterns) that span sessions."
  ],
  "severity": {
    "qualitative": "High"
  },
  "source_urls": [
    "https://atlas.mitre.org/techniques/AML.T0080",
    "https://embracethered.com/blog/posts/2024/chatgpt-hacking-memories/"
  ],
  "date_documented": "2025-04-09",
  "date_added": "2026-05-18",
  "disclosure_status": "atlas_catalog",
  "exploited_in_the_wild": "yes",
  "mitigations": [
    "Require explicit user confirmation before any memory write following a browsed/retrieved-content turn.",
    "Surface persistent memory to the user with one-click revocation per entry.",
    "Filter memory writes for instruction-shaped phrasing; allow only factual statements about the user."
  ],
  "related_vulnerabilities": [
    "CVE-2025-0845"
  ],
  "tags": ["memory-poisoning", "persistence", "agent-attack"]
}
