{
  "$schema": "../schema.json",
  "exploit_id": "AML.T0083",
  "title": "Credentials from AI Agent Configuration",
  "description": "An adversary harvests credentials — API keys, OAuth tokens, database connection strings, model-provider keys — from an AI agent's configuration. Agents commonly store provider credentials in config files, environment variables, or chatflow-node parameters because secret managers add deployment friction. Reading the configuration once yields direct access to the integrated services and, frequently, the agent's full model-provider quota.",
  "target_component": "agent_framework",
  "dsgai_mapping": ["DSGAI02", "DSGAI03"],
  "mitre_atlas_mapping": ["AML.T0083"],
  "owasp_llm_top10_mapping": ["LLM06:2025", "LLM03:2026"],
  "attack_steps": [
    "Gain read access to the agent's configuration — via path traversal, SSRF, authentication bypass, or compromised host.",
    "Locate credential fields (look for *_api_key, AUTH_TOKEN, connection-string patterns, OAuth client secrets).",
    "Exfiltrate the credential material.",
    "Use the stolen credentials to access the integrated services directly, outside the agent's audit boundary."
  ],
  "prerequisites": [
    "Read access to the agent's filesystem, config endpoint, or chatflow definition."
  ],
  "impact": [
    "credential_exposure",
    "data_exfiltration",
    "privilege_escalation"
  ],
  "detection_indicators": [
    "Provider API requests from IPs that don't match the agent's host.",
    "Sudden quota spikes against model-provider accounts tied to the agent.",
    "File reads of config paths from unexpected processes or users."
  ],
  "severity": {
    "qualitative": "High"
  },
  "source_urls": [
    "https://atlas.mitre.org/techniques/AML.T0083"
  ],
  "date_documented": "2025-04-09",
  "date_added": "2026-05-18",
  "disclosure_status": "atlas_catalog",
  "exploited_in_the_wild": "yes",
  "mitigations": [
    "Store credentials in a dedicated secret manager; never inline in chatflow nodes or config files.",
    "Scope provider API keys to per-agent usage with low quotas and IP allowlisting where supported.",
    "Rotate credentials after any agent platform compromise; assume any pre-incident secret is burned."
  ],
  "related_vulnerabilities": [
    "CVE-2024-3025",
    "CVE-2024-1561",
    "CVE-2024-31621",
    "CVE-2024-8181"
  ],
  "tags": ["credential-theft", "agent-config", "secret-exposure"]
}
